url,name,address,city,state,phone
http://www.centralvaaccounting.com/,"Central Virginia Accounting Solutions, LLC","3153 Chartwood Dr, Sandston, VA 23150",Sandston,VA,(804) 604-1524
https://lakecpa.com/,Faber CPA Firm LLC,"85 Westlake Rd, Hardy, VA 24101",Hardy,VA,(540) 719-4600
http://www.finessetax.com/,"Finesse Tax Accounting, LLC","107 W Federal St Suite 2, Middleburg, VA 20117",Middleburg,VA,(703) 812-4750
http://www.ninamckee.com/,Carter Mc Kee Nina CPA,"16 Harris Hollow Rd, Washington, VA 22747",Washington,VA,(540) 987-8386
http://www.accountingplus.net/,Accounting Associates Inc,"303 Church St SE, Blacksburg, VA 24060",Blacksburg,VA,(540) 953-3192
