url,name,address,city,state,phone
https://merakiaccountingtax.com/,"Meraki Accounting and Tax, LLC","ÓÉą13203 N Enon Church Rd Ste A151, Chester, VA 23836",Chester,VA,Óāį(804) 469-8500
http://www.andersontaxpro.com/,Anderson & Associates,"ÓÉą200 Lakeview Ave # A, Colonial Heights, VA 23834",Colonial Heights,VA,Óāį(804) 526-4848
http://www.yeagercpa.com/,Yeager & Company CPAs,"ÓÉą445 Battlefield Blvd N # R, Chesapeake, VA 23320",Chesapeake,VA,Óāį(757) 436-4708
https://www.facebook.com/p/Harris-Accounting-Tax-Service-LLC-61552426587991/,"Harris Accounting & Tax Service, LLC Paul D. Harris, CPA Andrew J. Harris, EA","ÓÉą33790 Main St Suite 101, Jonesville, VA 24263",Jonesville,VA,Óāį(276) 346-1972
http://www.toddowenscpa.com/,"Owens CPA & Associates, PC","ÓÉą17339 Anchorage Cir, Vansant, VA 24656",Vansant,VA,Óāį(276) 935-7351
http://www.kennethliucpa.com/,"Kenneth K. Liu, CPA, LLC","ÓÉą44081 Pipeline Plaza #215, Ashburn, VA 20147",Ashburn,VA,Óāį(703) 723-6388
https://suffolkcpas.com/,"Anderson & Anderson, CPAs, P.C.","ÓÉą2000 N Hillpoint Blvd Ste 100, Suffolk, VA 23434",Suffolk,VA,Óāį(757) 925-2115
http://accountingaccuracyllc.com/,Accounting Accuracy LLC,"ÓÉą2306 W Main St, Richmond, VA 23220",Richmond,VA,Óāį(804) 562-4232
http://www.barrystrickland.com/,"Barry Strickland & Company, Certified Public Accountants","ÓÉą9410 Atlee Commerce Blvd #1, Ashland, VA 23005",Ashland,VA,Óāį(804) 550-8500
http://www.vscpa.com/,Virginia Society of Certified Public Accountants (VSCPA),"ÓÉą4309 Cox Rd, Glen Allen, VA 23060",Glen Allen,VA,Óāį(804) 270-5344
http://www.acpa4uinc.com/,A CPA 4UśúÉŤ®ąŚłę,"ÓÉą11219 Nuckols Rd e, Glen Allen, VA 23059",Glen Allen,VA,Óāį(804) 346-2272
https://www.sethenterprisescpa.com/,"Seth Enterprises, CPA","ÓÉą22066 Auction Barn Dr, Ashburn, VA 20148",Ashburn,VA,Óāį(703) 723-9651
http://bit.ly/m/livingtrust,Rahul Maitra CPA,"ÓÉą8810 Irish Rd, Faber, VA 22938",Faber,VA,Óāį(914) 806-4811
https://www.handycpas.com/,"Roger L. Handy, PC","ÓÉą1064 Laskin Rd Ste 25C, Virginia Beach, VA 23451",Virginia Beach,VA,Óāį(757) 965-7501
